{
  "$schema": "./taxonomy.schema.v1.json",
  "schemaVersion": 1,
  "contentVersion": 1,
  "updatedAt": "2026-10-18T21:00:00Z",
  "categories": [
    {
      "id": "booked",
      "label": "Bokat",
      "kind": "status",
      "iconId": "calendar",
      "colors": {
        "light": "#238636",
        "dark": "#30d158"
      }
    },
    {
      "id": "see-do",
      "label": "Se & göra",
      "kind": "place",
      "iconId": "museum",
      "colors": {
        "light": "#2463a7",
        "dark": "#8bbfff"
      }
    },
    {
      "id": "craft",
      "label": "Hantverk",
      "kind": "place",
      "iconId": "scissors",
      "colors": {
        "light": "#7844a1",
        "dark": "#cba4f2"
      }
    },
    {
      "id": "food-drink",
      "label": "Mat & dryck",
      "kind": "place",
      "iconId": "restaurant",
      "colors": {
        "light": "#b95000",
        "dark": "#ff9f0a"
      }
    },
    {
      "id": "shopping",
      "label": "Shopping",
      "kind": "place",
      "iconId": "bag",
      "colors": {
        "light": "#8d7100",
        "dark": "#ffd60a"
      }
    },
    {
      "id": "hotel",
      "label": "Boende",
      "kind": "place",
      "iconId": "home",
      "colors": {
        "light": "#238636",
        "dark": "#30d158"
      }
    }
  ],
  "subcategories": [
    {
      "id": "churches",
      "categoryId": "see-do",
      "label": "Kyrkor & kapell",
      "iconId": "church"
    },
    {
      "id": "museums",
      "categoryId": "see-do",
      "label": "Museer & palats",
      "iconId": "museum"
    },
    {
      "id": "city",
      "categoryId": "see-do",
      "label": "Torg & stadsmiljö",
      "iconId": "place"
    },
    {
      "id": "views",
      "categoryId": "see-do",
      "label": "Utsikter",
      "iconId": "view"
    },
    {
      "id": "gardens",
      "categoryId": "see-do",
      "label": "Trädgårdar",
      "iconId": "garden"
    },
    {
      "id": "textiles",
      "categoryId": "craft",
      "label": "Textil & siden",
      "iconId": "weaving"
    },
    {
      "id": "paper",
      "categoryId": "craft",
      "label": "Papper & bokbinderi",
      "iconId": "book"
    },
    {
      "id": "leather",
      "categoryId": "craft",
      "label": "Läder",
      "iconId": "bag"
    },
    {
      "id": "mosaics",
      "categoryId": "craft",
      "label": "Mosaik & stenintarsia",
      "iconId": "mosaic"
    },
    {
      "id": "woodwork",
      "categoryId": "craft",
      "label": "Träsnideri",
      "iconId": "wood"
    },
    {
      "id": "design",
      "categoryId": "craft",
      "label": "Design & hantverk",
      "iconId": "mosaic"
    },
    {
      "id": "perfume",
      "categoryId": "craft",
      "label": "Dofter & parfym",
      "iconId": "perfume"
    },
    {
      "id": "restaurants",
      "categoryId": "food-drink",
      "label": "Restauranger",
      "iconId": "restaurant"
    },
    {
      "id": "ice-cream",
      "categoryId": "food-drink",
      "label": "Glass",
      "iconId": "ice-cream"
    },
    {
      "id": "wine-bars",
      "categoryId": "food-drink",
      "label": "Vinbarer",
      "iconId": "wine"
    },
    {
      "id": "bars",
      "categoryId": "food-drink",
      "label": "Barer & aperitivo",
      "iconId": "bar"
    },
    {
      "id": "cafes",
      "categoryId": "food-drink",
      "label": "Caféer",
      "iconId": "cafe"
    },
    {
      "id": "food-markets",
      "categoryId": "shopping",
      "label": "Matmarknader",
      "iconId": "market"
    },
    {
      "id": "gifts",
      "categoryId": "shopping",
      "label": "Design & presenter",
      "iconId": "bag"
    },
    {
      "id": "hotels",
      "categoryId": "hotel",
      "label": "Boende",
      "iconId": "home"
    },
    {
      "id": "bridges",
      "categoryId": "see-do",
      "label": "Broar",
      "iconId": "bridge"
    },
    {
      "id": "yarn-haberdashery",
      "categoryId": "shopping",
      "label": "Garn & sybehör",
      "iconId": "yarn"
    },
    {
      "id": "stationery",
      "categoryId": "shopping",
      "label": "Papper & skrivmaterial",
      "iconId": "book"
    }
  ],
  "icons": {
    "museum": [
      "M3 9h18M4 20h16M6 10v8M10 10v8M14 10v8M18 10v8M2 8l10-5 10 5"
    ],
    "church": [
      "M5 21V10l7-5 7 5v11M9 21v-6h6v6M12 2v6M9 4h6M8 11h1M15 11h1"
    ],
    "view": [
      "M2 19l7-12 5 8 3-5 5 9H2M6 12l3 2 2-2M17 3h.01"
    ],
    "garden": [
      "M12 21V12M12 15c-8 0-9-7-9-7s8-1 9 7ZM12 12c0-8 8-9 8-9s1 8-8 9Z"
    ],
    "place": [
      "M19 10c0 5-7 11-7 11S5 15 5 10a7 7 0 1 1 14 0ZM9 10a3 3 0 1 0 6 0 3 3 0 1 0-6 0"
    ],
    "bridge": [
      "M3 7v14M21 7v14M3 10c6 8 12 8 18 0M3 18h18M8 15v3M12 16v2M16 15v3"
    ],
    "scissors": [
      "M8 8l12 12M8 16L20 4M3 5a3 3 0 1 0 6 0 3 3 0 1 0-6 0M3 19a3 3 0 1 0 6 0 3 3 0 1 0-6 0"
    ],
    "weaving": [
      "M4 3v18M9 3v18M15 3v18M20 3v18M3 5h18M3 10h18M3 15h18M3 20h18"
    ],
    "book": [
      "M12 5c-3-2-6-2-9-1v15c3-1 6-1 9 1 3-2 6-2 9-1V4c-3-1-6-1-9 1ZM12 5v15"
    ],
    "bag": [
      "M5 8h14l1 13H4L5 8ZM8 8V6a4 4 0 0 1 8 0v2"
    ],
    "mosaic": [
      "M3 3h7v7H3ZM14 3h7v7h-7ZM3 14h7v7H3ZM14 14h7v7h-7Z"
    ],
    "wood": [
      "M8 3v18M16 3v18M4 5h16v14H4M8 8c5-3 5 4 8 1M8 14c4 3 4-3 8-1"
    ],
    "perfume": [
      "M9 3h6v4H9ZM8 9h8l3 4v8H5v-8l3-4ZM9 14h6v3H9"
    ],
    "restaurant": [
      "M4 3v6a3 3 0 0 0 6 0V3M7 3v18M17 3c-2 4-3 7 0 9v9M17 3v9h3V3h-3"
    ],
    "ice-cream": [
      "M7 11l5 10 5-10M5 11h14M7 11a4 4 0 0 1 0-8 5 5 0 0 1 10 0 4 4 0 0 1 0 8"
    ],
    "wine": [
      "M8 3h8l1 6c1 6-11 6-10 0l1-6ZM12 13v8M8 21h8M7 8h10"
    ],
    "bar": [
      "M3 4h18l-9 10L3 4ZM12 14v7M8 21h8M7 8h10"
    ],
    "cafe": [
      "M4 5h12v7a6 6 0 0 1-12 0V5ZM16 6h2a3 3 0 0 1 0 6h-2M3 21h15M7 1v1M12 1v1"
    ],
    "market": [
      "M3 9h18l-2-6H5L3 9ZM4 9v12h16V9M8 21v-7h8v7M3 9c0 3 4 3 4 0 0 3 5 3 5 0 0 3 5 3 5 0 0 3 4 3 4 0"
    ],
    "home": [
      "M3 10l9-7 9 7M5 9v12h14V9M9 21v-7h6v7"
    ],
    "calendar": [
      "M4 5h16v16H4ZM8 3v4M16 3v4M4 10h16M8 15l3 3 5-5"
    ],
    "yarn": [
      "M3 10a7 7 0 1 0 14 0 7 7 0 1 0-14 0",
      "M4 6c5 0 9 3 12 8M3 10c4 0 8 3 11 6M7 3c0 5 3 10 8 13M11 3c0 5 2 8 6 10",
      "M13 17c0 3 2 4 4 3s2-2 4-1"
    ]
  }
}
